{
  "contract_type": "AgreementPolicy",
  "contract_version": 1,
  "policy_id": "policy-review-invitation-v1",
  "policy_version": 1,
  "document_id": "doc-review-invitation-001",
  "context_id": "context-coordination",
  "scope_id": "scope-order-2026-001",
  "usage_scope": "review-invitation/v1",
  "channel_id": "channel-order-review-001",
  "membership_epoch": 7,
  "role_binding_version": 3,
  "acceptance_slot": "review_after_delivery",
  "required_domain_roles": [
    "fulfillment_owner",
    "settlement_owner"
  ],
  "allowed_decisions": [
    "approve",
    "object",
    "abstain",
    "retract"
  ],
  "role_decision_rule": "named_representatives",
  "role_representatives": [
    {
      "domain_role": "fulfillment_owner",
      "actor_org_id": "org-nuri-fulfillment",
      "actor_id": "person-junseo-lee"
    },
    {
      "domain_role": "settlement_owner",
      "actor_org_id": "org-nuri-settlement",
      "actor_id": "person-hyejin-choi"
    }
  ]
}
